No.     Time           Source                Destination           Protocol Length Info
     39 0.097940       192.168.22.128        trn06s03-in-f14.1e100.net TLSv1.3  1286   Client Hello (SNI=ogs.google.com)

Frame 39: 1286 bytes on wire (10288 bits), 1286 bytes captured (10288 bits) on interface \Device\NPF_{07515E87-3309-40D4-A832-6B0543B2CEBB}, id 0
Ethernet II, Src: VMware_f7:cd:1f (00:0c:29:f7:cd:1f), Dst: VMware_fe:da:11 (00:50:56:fe:da:11)
Internet Protocol Version 4, Src: 192.168.22.128 (192.168.22.128), Dst: trn06s03-in-f14.1e100.net (142.251.143.174)
Transmission Control Protocol, Src Port: 60866, Dst Port: 443, Seq: 1, Ack: 1, Len: 1232
Transport Layer Security
[Community ID: 1:BNN8K5W4tJXs6vXUXI2Uiy9nHMo=]

No.     Time           Source                Destination           Protocol Length Info
    140 0.846483       192.168.22.128        trn06s04-in-f3.1e100.net TLSv1.3  1287   Client Hello (SNI=www.gstatic.com)

Frame 140: 1287 bytes on wire (10296 bits), 1287 bytes captured (10296 bits) on interface \Device\NPF_{07515E87-3309-40D4-A832-6B0543B2CEBB}, id 0
Ethernet II, Src: VMware_f7:cd:1f (00:0c:29:f7:cd:1f), Dst: VMware_fe:da:11 (00:50:56:fe:da:11)
Internet Protocol Version 4, Src: 192.168.22.128 (192.168.22.128), Dst: trn06s04-in-f3.1e100.net (142.251.143.195)
Transmission Control Protocol, Src Port: 40312, Dst Port: 443, Seq: 1, Ack: 1, Len: 1233
Transport Layer Security
[Community ID: 1:x3lC0XmgLX9bCDpIMj65dLOYu1Q=]
Spirent Test Center Signature

No.     Time           Source                Destination           Protocol Length Info
    189 2.035217       192.168.22.128        ssl.gstatic.com       TLSv1.3  1287   Client Hello (SNI=ssl.gstatic.com)

Frame 189: 1287 bytes on wire (10296 bits), 1287 bytes captured (10296 bits) on interface \Device\NPF_{07515E87-3309-40D4-A832-6B0543B2CEBB}, id 0
Ethernet II, Src: VMware_f7:cd:1f (00:0c:29:f7:cd:1f), Dst: VMware_fe:da:11 (00:50:56:fe:da:11)
Internet Protocol Version 4, Src: 192.168.22.128 (192.168.22.128), Dst: ssl.gstatic.com (142.251.143.163)
Transmission Control Protocol, Src Port: 57668, Dst Port: 443, Seq: 1, Ack: 1, Len: 1233
Transport Layer Security
[Community ID: 1:SRiNCtcUEeDRlmNzcsCsuf1TACI=]
